[
 {
  "id": "RETRO-01",
  "family": "pixel-retro-stylized",
  "name_ar": "مشهد بكسل في ملف HTML واحد",
  "name_en": "Self-contained pixel cutscene (one HTML)",
  "status": "proven",
  "what": "مشهد Canvas 2D بدقة منطقية صغيرة يُكبَّر بمعامل صحيح، بخطوة منطق 60 Hz وعِفريتات 8–12 إطارًا/ث، وبارالاكس وحوار يُكتب، وواجهة seek للرندر الدقيق. / A Canvas 2D scene at a tiny logical resolution, integer-scaled, 60 Hz logic, 8–12 fps sprites, parallax, typed dialogue and a seek hook for frame-accurate rendering.",
  "how": "Logical 160×144, 240×160 or 320×180; ctx.imageSmoothingEnabled=false; Math.round every position; CSS image-rendering:pixelated; embed sprites as offscreen canvases; expose window.__pixelScene {seek, frameDataURL, play, duration} (or window.__kosif.seek) and render with kosif-tool render_html.cjs, or render frames and upscale with ffmpeg. Verified here: a 320×180 scene upscaled ×6 with flags=neighbor stayed blocky (mean intra-block std 2.37 after H.264). (code snippet in references/powers/pixel-retro-stylized.md)",
  "params": "320×180 ×6 = 1920×1080 · 60 Hz logic · sprites 8–12 fps",
  "install": "",
  "requires": [
   "ffmpeg",
   "node",
   "chromium"
  ],
  "license": "",
  "proof": [
   "kosif-atlas/skills/2460-pixel-art/9526-scene/SKILL.md",
   "kosif-tool/tools/render_html.cjs",
   "kosif-tool/styles/pixel-art/SKILL.md",
   "style:pm-hoyoyoda-3a5c08"
  ],
  "proof_scope": "repo",
  "styles": [
   "pixel-art",
   "pm-hoyoyoda-3a5c08",
   "pm-pluginplay-3d4006"
  ],
  "tags": [
   "بكسل",
   "ريترو",
   "pixel art",
   "cutscene",
   "nearest neighbour",
   "integer scale",
   "8-bit",
   "مشهد ألعاب",
   "ألعاب قديمة",
   "بكسلي",
   "canvas",
   "retro game"
  ],
  "when": "حين يطلب المستخدم مشهد ألعاب قديمة بكسليًا فيه عفريتات تتحرك وحوار يُكتب وخلفية بارالاكس / when the user wants a retro pixel-game cutscene with sprites, parallax and typed dialogue"
 },
 {
  "id": "RETRO-02",
  "family": "pixel-retro-stylized",
  "name_ar": "الإضاءة والتلاشي بدثر Bayer",
  "name_en": "Bayer-dither fades & palette-stepped light",
  "status": "proven",
  "what": "التلاشي وتغير الضوء يتدرجان عبر ألوان اللوحة أو مصفوفة Bayer 4×4/8×8، لا عبر الشفافية أو التدرج أو الضبابية. / Fades and light changes step through palette colours or a 4×4/8×8 Bayer matrix — never alpha, gradients or blur.",
  "how": "Per pixel compare the fade level with B[y%4][x%4]/16 (4×4 = 0 8 2 10 / 12 4 14 6 / 3 11 1 9 / 15 7 13 5); quantise brightness to the palette ramp with the same threshold as offset. Verified here with the Game Boy ramp #0f380f #306230 #8bac0f #9bbc0f: output frames contain exactly 4 colours. (code snippet in references/powers/pixel-retro-stylized.md)",
  "params": "Bayer 4×4 / 8×8 · 4-colour ramp",
  "install": "",
  "requires": [],
  "license": "",
  "proof": [
   "kosif-atlas/skills/2460-pixel-art/9526-scene/SKILL.md",
   "kosif-atlas/skills/2460-pixel-art/9530-vfx/SKILL.md"
  ],
  "proof_scope": "sibling",
  "styles": [],
  "tags": [
   "دثر",
   "bayer",
   "dither",
   "fade",
   "palette ramp",
   "game boy",
   "تلاشي",
   "إضاءة بكسل",
   "ظهور تدريجي",
   "pixel fade",
   "ordered dither"
  ],
  "when": "حين تريد تلاشيًا أو تغير إضاءة في مشهد بكسل بخطوات اللوحة أو نقش الدثر بدل الشفافية والتدرج / when fading or relighting a pixel scene through palette steps or a Bayer pattern, not alpha or blur"
 },
 {
  "id": "RETRO-03",
  "family": "pixel-retro-stylized",
  "name_ar": "عفريتات مقفلة اللوحة ومولّد الوضعيات",
  "name_en": "Palette-locked sprites & procedural pose generator",
  "status": "ready",
  "what": "عفريتات صغيرة كشبكات حروف مربوطة بلوحة ثابتة، والكبيرة يولّدها draw(direction, pose) من زوايا الأطراف وطور الخطوة فيبقى كل إطار على النموذج. / Small sprites as character grids mapped to a fixed palette; larger ones from a draw(direction, pose) generator so every frame stays on-model.",
  "how": "Pillow: rows of palette keys → PNG at 1×, nearest ×8 preview; hand grids ≤~24×24 (observed 16×16 ×3). Rules: silhouette first, one light direction (top-left), hue-shifted ramps, palette roles highlight/base/shadow/line, selective 1 px connected outline, no pillow shading, no dithering on small sprites. Cycles planned in a table (key poses, frame counts, durations); RPG Maker MZ walk = 3 patterns 0-1-2-1 at 48×48; mirror only symmetric designs; GIF delays in 10 ms units, floor 20 ms; hold impact frames; sizes 16/32/48.",
  "params": "≤24×24 hand grid · MZ 48×48 · GIF ≥20 ms",
  "install": "",
  "requires": [
   "pip:pillow"
  ],
  "license": "",
  "proof": [
   "kosif-atlas/skills/2460-pixel-art/9527-sprite",
   "kosif-atlas/skills/2460-pixel-art/9525-animate/SKILL.md",
   "100-superskills/skills/pixel-art-game-assets/SKILL.md:22",
   "style:pm-aisongman-71ffac"
  ],
  "proof_scope": "sibling",
  "styles": [
   "pm-aisongman-71ffac"
  ],
  "tags": [
   "عفريت",
   "sprite",
   "walk cycle",
   "palette",
   "pixel character",
   "شخصية بكسل",
   "دورة مشي",
   "رسم شخصية",
   "pillow",
   "pose generator"
  ],
  "when": "حين تحتاج شخصية بكسل بإطارات مشي أو وضعيات متعددة تبقى ثابتة الألوان والشكل في كل إطار / when you need a pixel character with walk frames or poses that stay on-palette and on-model"
 },
 {
  "id": "RETRO-04",
  "family": "pixel-retro-stylized",
  "name_ar": "مؤثرات بكسل بخطوات اللوحة",
  "name_en": "Palette-stepped pixel VFX sheets",
  "status": "documented",
  "what": "شرارات وضربات وانفجارات كأوراق عفريتات تتلاشى بالنزول على سلّم اللوحة، مع إمساك إطار الارتطام. / Sparks, slashes and explosions as sprite sheets that fade down a palette ramp, holding the impact frame.",
  "how": "Python stdlib renderer from a spec; timing table first; sheet in engine order + preview GIF; contact/pass checks; 2–4 review rounds. Radial speed lines (anime/manga) flicker per frame behind the hit.",
  "params": "GIF ≥20 ms · hold impact",
  "install": "",
  "requires": [
   "python3"
  ],
  "license": "",
  "proof": [
   "kosif-atlas/skills/2460-pixel-art/9530-vfx/SKILL.md",
   "100-superskills/skills/pixel-art-game-assets/SKILL.md:24",
   "style:pm-allforbigfire-86ff3c"
  ],
  "proof_scope": "sibling",
  "styles": [
   "pm-allforbigfire-86ff3c"
  ],
  "tags": [
   "مؤثرات",
   "شرارة",
   "pixel vfx",
   "explosion",
   "sprite sheet",
   "impact",
   "انفجار",
   "ضربة",
   "خطوط سرعة",
   "slash",
   "hit effect"
  ],
  "when": "حين تريد شرارات أو ضربات أو انفجارات بكسلية كورقة عفريتات مع إمساك لحظة الارتطام / when you need pixel sparks, slashes or explosions as sprite sheets that hold the impact frame"
 },
 {
  "id": "RETRO-05",
  "family": "pixel-retro-stylized",
  "name_ar": "البلاطات والبارالاكس",
  "name_en": "Seamless tiles & parallax rules",
  "status": "documented",
  "what": "بلاطات blob-47 أو 16 زاوية، ولكل خلفية قطع مملوءة وفارغة وحواف وزوايا داخلية وخارجية ومعزولة؛ وطبقات البارالاكس أبطأ وأغمق وأقل تفصيلًا مع العمق. / blob-47 or 16-tile corner sets covering every transition; parallax layers slower, darker and simpler with depth.",
  "how": "Preview a 3×3 repeat to catch seams; test on a compact map exercising every transition and narrow passage; pad atlas cells against bleed; the scroll step must divide the loop width; RPG Maker A1–A5/B–E layouts; render pans via render_html.cjs.",
  "params": "blob-47 · 16-tile corner · 3×3 seam preview",
  "install": "",
  "requires": [
   "node",
   "chromium"
  ],
  "license": "",
  "proof": [
   "kosif-atlas/skills/2460-pixel-art/9528-tileset",
   "kosif-atlas/skills/1526-gamegen/4172-game-tilesets/SKILL.md",
   "100-superskills/skills/pixel-art-game-assets/references/sources.md:9"
  ],
  "proof_scope": "sibling",
  "styles": [],
  "tags": [
   "بلاطات",
   "tiles",
   "tileset",
   "parallax",
   "seamless",
   "autotile",
   "خلفية لعبة",
   "بارالاكس",
   "طبقات عمق",
   "rpg maker",
   "game map"
  ],
  "when": "حين تبني خلفية ألعاب من بلاطات متكررة بلا فواصل أو طبقات بارالاكس تتحرك بسرعات مختلفة / when building a seamless tiled game background or depth parallax layers scrolling at different speeds"
 },
 {
  "id": "RETRO-06",
  "family": "pixel-retro-stylized",
  "name_ar": "حركة على شبكة صحيحة والرسم على الاثنين",
  "name_en": "Integer-grid motion & animating on twos",
  "status": "proven",
  "what": "كل حركة تقفز بكسلًا كاملًا على شبكة منخفضة، والحركة «على الاثنين» (12 رسمة/ث) تعطي إحساس اليد والستوب موشن. / All motion snaps to whole pixels on a low-res grid; animating on twos (12 drawings/s) gives a hand-made, stop-motion feel.",
  "how": "Math.round(x) on the logical grid (verified: an 8×8 block moved in 1 px steps); quantise time: t2 = floor(t*12)/12 for twos, or 12 fps steps for snappy paper cutouts (pop/drop/slide with short settle, no slow CGI drift — Fastify theme N and the vox collage profile request it in prompts). (code snippet in references/powers/pixel-retro-stylized.md)",
  "params": "12 drawings/s · 1 px steps",
  "install": "",
  "requires": [],
  "license": "",
  "proof": [
   "kosif-tool/playbooks/characters.md:29",
   "kosif-tool/styles/pm-0xevinho-3777d8/BRIEF.md",
   "fastify-motion-bro/scripts/profiles/vox-history.mjs:11,50"
  ],
  "proof_scope": "repo",
  "styles": [],
  "tags": [
   "على الاثنين",
   "on twos",
   "stop motion",
   "integer",
   "stepped",
   "cutout",
   "ستوب موشن",
   "حركة متقطعة",
   "قص ورق",
   "12 fps",
   "paper cutout"
  ],
  "when": "حين تريد حركة متقطعة بإحساس يدوي أو ستوب موشن أو قص ورق بدل الانسياب الناعم / when you want stepped, hand-made or stop-motion-feel motion on whole pixels instead of smooth drift"
 },
 {
  "id": "RETRO-07",
  "family": "pixel-retro-stylized",
  "name_ar": "ديوراما بكسل بانعكاس ماء",
  "name_en": "Pixel diorama with water reflection",
  "status": "seen",
  "what": "ارسم المشهد على Canvas صغير (~480×270)، اعكس النصف العلوي في البحيرة بلون أغمق وإزاحة جيبية أفقية لكل صف، ثم كبّر ×4. / Render at ~480×270, mirror the upper half into the lake with a darker tint and per-row sine offset, upscale ×4.",